Setting,Customize,Hints,Examples
Map Info,,"For help, see tutorial in DataVizForAll.org      ------>",http://www.datavizforall.org/leaflet/with-google-sheets
Map Title,Prova Leaflet Maps with Google Sheets Polygons,Insert your map title. Always appears in browser tab,
Map Subtitle,demonstration of polygons only,Add context (or leave blank),
Display Title,on,"Select ""on"" to display title at top of map",
Author Name,Ezequiel Ruibal,"Appears in credits as ""View data by..."" (or leave blank)",
Author Email or Website,eze1965@gmail.com,Insert your email or web address to appear as link in Author Name (or leave blank),
Author Code Credit,"<a href=""http://datavizforall.org"">DataVizForAll</a>","Appears in credits as ""View code by..."" (or leave blank)",
Author Code Repo,https://github.com/JackDougherty/leaflet-maps-with-google-sheets-polygons,"Insert your code repo URL to appear as link in ""View code by..."" (or leave blank)",
Map Settings,,"For help, see tutorial in DataVizForAll.org      ------>",http://www.datavizforall.org/leaflet/with-google-sheets
Basemap Tiles,CartoDB.PositronNoLabels,Select basemap background from drop-down menu,https://leaflet-extras.github.io/leaflet-providers/preview/
Cluster Markers,off,"Display tightly-packed groups of markers as numbers, until zoomed in to view details.",
Intro Popup Text,,Show intro text pop-up on startup (or leave blank),
Initial Zoom,3,Leave blank to auto-zoom to display all markers (or insert number between 1 [zoomed out] and 18 [zoomed in]),
Initial Center Latitude,37,Leave blank to auto-center for all markers (or insert initial latitude),
Initial Center Longitude,-95.7,Leave blank to auto-center for all markers (or insert initial longitude),
Map Controls,,,
Search Button,topright,Display the Mapzen search box (magnifying glass),
Mapzen Search Key,search-jBPBt5y,Mapzen Search box requires free API key. Please insert your own,https://mapzen.com/dashboard
Search Radius,5 miles,Select radius for results from Mapzen search,
Search Results Zoom Level,12,Select zoom level to display search results (larger = zoom in more),
Show My Location,topright,Display the Show My Location button (black marker),
Zoom Controls,topright,Display the Zoom Controls,
Credits and Attribution,bottomright,Display the credits,
Point Map Controls,,"For help, see tutorial in DataVizForAll.org      ------>",http://www.datavizforall.org/leaflet/with-google-sheets
Point Legend Title,Sample points,Show title at top of Points legend (or leave blank),
Point Legend Position,off,Display the Points legend,
Table Controls,,,
Display Table,off,Display Table of all Points shown in current map ,
Table Height,20,Height of table (as percentage of map; 40 percent is default),
Table Columns,"Name,Location,Description",Columns from Points sheet to display in Table (or leave blank),
Table Header Color,,"Background color of table header (default is black). If desired, insert a comma and specify table text color (default is black).",
Polyline Map Controls,,,
Polyline Legend Title,Sample polylines,Show title at top of Polyline legend (or leave blank),
Polyline Legend Position,off,Display Polyline legend,
Polyline Thickness,2,Select thickness of all Polylines (in pixels),